{
  "format": "combat-take-review/1",
  "take_id": "synthetic-user-report-01",
  "plan_id": "alley-letter-15",
  "plan_digest": "71f9d66624d772637d9398dbc7e8f31ced3ce39d88949ff30fb7fe8b52da1b93",
  "media": {
    "id": "synthetic-user-report-01",
    "location": "",
    "sha256": "",
    "evidence_kind": "user_report",
    "observation_method": "user_report",
    "covered_ranges": [
      {
        "start": 10.5,
        "end": 15
      }
    ],
    "audio_observed": false
  },
  "completed_events": [],
  "incomplete_events": [],
  "unexpected_events": [],
  "observed_end_state": {
    "A": "南口内侧；左手持完整密函，右手空；木杖在南口脚边；朝向B，双脚落地，无损伤",
    "B": "北口内侧；关注对方及退路；双脚落地；左手空，右手空；损伤：无；限制：无",
    "environment": "南口：可退出；北口：可退出；砖墙：完整",
    "camera_side": "南侧"
  },
  "state_evidence": "合成评估输入：模拟用户报告右手木杖在10.5秒提前落地，结尾仍在南口；不是实际媒体观察。",
  "deviations": [
    {
      "time": 10.5,
      "observation": "木杖从A右手提前落地",
      "impact": "后续A右手空，木杖留在南口",
      "repair": "下一段从观察状态开始，不复位到持杖"
    }
  ],
  "decision": "accept_with_deviation",
  "decision_by": "simulated-user",
  "decision_reason": "模拟用户明确接受落杖偏差，后续保留空手。"
}
